FGT5006,DNS Manipulation,"Passive Identity Mapping Attack – Check ATT&CK, this might have addendums. (Network Sniffing, Technique T1040 - Enterprise | MITRE ATT&CK®). Both passive attacks are probably T040. Send email to Dr. Michaela to ask if these two attacks are already present and if they should be an addendum to T1040 or possibly sub techniques to something else.","Passive attack. Match transient radio identities to more permanent network identities, identifying users in the cell and preparing the battlefield for follow on attacks."
FGT5006,DNS Manipulation,Unmask User Web Activities - this might have addendums. See comment in previous line.,"Passive attack. Abuse the resource allocation as
a side channel to perform website fingerprinting that enables
the attacker to learn the websites a user accessed."
FGT5006,DNS Manipulation,"ALTER Attack (DNS Redirection, may have addendums in ATT&CK). This might need to be its own technique or might be a sub technique under DNS Manipulation.","Active attack. The ALTER attack that exploits the fact that LTE user
data is encrypted in counter mode (AES-CTR) but not integrity
protected, which allows us to modify the message payload."
FGT5002,Bypass home routing,Incorrect implementation/configuration or compromised SMS home router can allow bypass of the SMS location query messages.,[Section 7.2.2 of GSMA NG.111]
FGT5011,Unauthorized access to NEF via token fraud,Existing OAuth 2.0 attacks,Attacks that are applicable to machine to machine communication (so no email phishing attacks)
FGT5034,Charging fraud via NF control,SMF control,"An adversary may control the SMF and assign the same SMF Charging Identifier to a device data flow as that of an existing victim device, to cause charging errors. 
 (section 5.1.4 & annex A.1 of 32.255).
The SMF can also pause charging for a given UE (even though not warranted), section 4.4.4. of TS23.502.
The SMF can also misreport 5G data used by a given UE."
FGT5034,Charging fraud via NF control,PCF control,An adversary with control over the PCF can change policy so that UE is allowed to consume a service it was not subscribed to- but it will still be traceable to that UE. Section 4.3.2 of 23.503.
FGT5034,Charging fraud via NF control,CHF control,"An adversary with control over the CHF can ignore when PCF tells it that the spending limit for this subscriber has been reached,or can ignore the SMS records from the SMSF (SMSF uses POST to put in data), or the SMF itself for 5G data it reports. [TS 32.240]"
FGT5034,Charging fraud via NF control,NEF control or Application Function (AF) control exploiting weak NEF,"Adversary on AF can attack a weak NEF. Or, the NEF can be compromised and conduct this attack without even an AF. 
An AF can ask the NEF to change the “chargeable party” (TS29.522 section 4.4.8, TS29.122 section 4.4.4). This is meant to support the AF being the chargeable party, but it’s imaginable how the AF can put a different AF as chargeable: it has to send the AF identifier, UE IP address, Sponsor ID, ASP ID, etc. even AppID"
T1565,Non-SBI,Compromised or misconfigured gNB or UPF can disable integrity protection for CP & UP communication between RAN and core or between two gNBs,"Integrity protection can be disabled on N2 interface for CP, N3 and N9 interfaces for UP and Xn interface for CP & UP. Sections 9.2, 9.3, 9.4 & 9.9 of [2]"
FGT5018.004,Theft of physical assets,Cable/Copper Theft,"Copper’s value transforms remote cellular base stations into prime targets for thieves. The costs for telecom and tower operators to replace the cost of the cable and damage to the site can be thousands of dollars per incident. This is not taking into consideration the additional costs of loss of network service. Even the theft of a small amount of copper can cause extensive damage to site equipment, costing cell towers owners thousands of dollars in repairs, replacement, and network downtime. There are several expensive copper items at cell sites that are very attractive to thieves, such as the ground wires, copper grounding busbars, and waveguides"
FGT5018.004,Theft of physical assets,Battery Theft,"Battery theft can easily become the root cause of cell services outage. Similarly, to the case of cable theft, telecom towers are increasingly affected by the rise of battery theft and vandalism."
FGT5018.004,Theft of physical assets, Fuel Theft, Fuel is a major asset at telecom sites that can easily and directly be sold by thieves. The threat of diesel theft is widespread in many emerging markets and even in the rural areas of the developed markets
T1195.501,SIM credential theft,Agency (GHCQ) infiltrated SIM vendor’s (Gemalto) network.,Allegedly: GHCQ planted malware on Gemalto servers to obtain SIM credentials. The number of keys are in the order of millions. [1]
T1018,Core-network scanning,"Tools exist for pen testing. Examples GTScan, SigPloit, SCTPScan and GTPScan.",
FGT5007,Registration of malicious network functions,API used is Nnrf_NFManagement,"Adversary uses this API to register one of these functions: AMF, SMF, UDM, AUSF, NEF, PCF, SMSF, NSSF, UPF, etc. Clause 5.2.7 of [3]"
FGT5012.005,Shared network function in slice,"Malicious NF belonging to compromised Slice gets an access token for the target AMF, which servers both target slice and compromised slice.","Malicious NF of a compromised slice gets access token for a shared AMF, but then asks AMF for the location of a UE in the target slice. The AMF checks that the authorization (OAuth) token is ok, which it is, but does not check that the UE ID is served by target slice, while the requester NF is from compromised slice."
FGT5001,Exploitation of Interconnect Edge Application Programming Interfaces,Denial of Service,The SEPP can be overloaded with API calls if it does not apply rate limiting.
FGT5001,Exploitation of Interconnect Edge Application Programming Interfaces,Sensitive data exposure,"Adversary uses an insecure API to take over the edge NF, then can use legitimate signaling to obtain sensitive UE or network data."
T1592.501,Internal resource search,IR.21 accessible from the Internet,"Claro Americas, and Vivo telecom, had in 2016 their IR.21 database accessible from an internet  (links [2], [3] no longer accessible)"
FGT5006.002,Billing Evasion,"Passive Identity Mapping Attack – Check ATT&CK, this might have addendums. (Network Sniffing, Technique T1040 - Enterprise | MITRE ATT&CK®). Both passive attacks are probably T040. Send email to Dr. Michaela to ask if these two attacks are already present and if they should be an addendum to T1040 or possibly sub techniques to something else.","Passive attack. Match transient radio identities to more permanent network identities, identifying users in the cell and preparing the battlefield for follow on attacks."
FGT5006.002,Billing Evasion,Unmask User Web Activities - this might have addendums. See comment in previous line.,"Passive attack. Abuse the resource allocation as
a side channel to perform website fingerprinting that enables
the attacker to learn the websites a user accessed."
T1557.506,Air Interface,Adversary-in-the-Middle on air interface for a given UE,"The adversary employs a back to back gNB-UE combination. When UE security profile allows bidding down, adversary denies service to 5G, bids down victim UE to less secure protocol with illegitimate signaling, acts as a man-in-the-middle to intercept and possibly modify communication, and relays communication to and from intended recipient."
T1557.506,Air Interface,Adversary-in-the-Middle on air interface for any UE,"Alternatively, if the 5G system employs null integrity or encryption, user data traffic can be eavesdropped or modified in transit over the air interface"
FGT5018,Vandalism of network infrastructure,"Communication center: unauthorized access, destruction of assets and impairment of operations",
FGT5018,Vandalism of network infrastructure,"Telecommunications equipment room:  unauthorized access, destruction of assets and impairment of operations.",
FGT5018,Vandalism of network infrastructure,"Physically isolated operation areas: unauthorized access, destruction of assets and impairment of operations",
FGT5018,Vandalism of network infrastructure,"Equipment sited in other carrier's or partner's premises: unauthorized access, destruction of assets and impairment of operations.",
T1557.501,Bid down UE,Fake gNB with stronger signal strength than legitimate gNBs sends RRC redirection that is not integrity protected.,UEs tend to attach to gNBs which have better signal condition than the gNB the UE is currently attached.
FGT5019.001,Intercept Home Network via SUCI,Intercept home network over the air.,"Receive SUCI and extract home network, which is never concealed."
