T1555.501,Hardware Security Module Key Signing,Credential compromise - theoretical,An adversary would compromise a function or service that has privileges to perform operations using the HSM and use other techniques to obtain the credentials. The adversary may perform operations from the compromised environment or exfiltrate the credentials to another system to perform the operations and conduct further activities.
FGT5019,Identify UE,Depends on sub-technique,
FGT5029,Exploit Semi-public Facing Application or System,None,
FGT5012,Locate UE,"Adversary may use the radio access network to determine that a particular UE is in the area, or where exactly the UE is located",Multiple subtechniques exist
FGT5012,Locate UE,Adversary may use the core network signaling to trigger the procedure of locating a particular UE via RAN,Multiple subtechniques exist
T1040,Non-SBI,None,
T1499.501,Consume data allocation to deny or degrade service,Malicious data consumption application,Convince user to download or maliciously introduce application that consumes excessive data
FGT5019.003,Obtain subscriber identifier by NF,External AF uses legitimate SBA API to retrieve subscriber identifier of victim UE (SUPI) from their phone number,AF calls Nnef_ApplyPolicy_Create API to NEF with UE's GPSI/phone number. NEF retrieves the SUPI from UDM by using Nudm_SDM_Get API. NEF stores the data in UDR and sends the requested data to AF. Section 4.15.6.8 of [1].
FGT5019.003,Obtain subscriber identifier by NF,Rogue NEF retrieves SUPI from GPSI/phone number using Nudm_SDM_Get API,Section 4.13.2.2 of [1].
FGT5019.003,Obtain subscriber identifier by NF,Rogue AMF in visited PLMN retrieves UE’s sensitive information using Nsmf_PDUSession_ContextRequest API during 5GS to EPC roaming.,"AMF in visited PLMN calls Nsmf_PDUSession_ContextRequest API to v/hSMF. SMF sends the UE SM context in response which can reveal the following UE information: SUPI, S-NSSAI, DNN, UE IP address etc. Section 4.11.1.2.1 & Table 5.2.8.2.10-1 of [1])"
T1498.501,Flooding core network component,"Control plane signaling storm from (at least) one malicious UE (source: experience of employee of large MNO, and who was responsible for threat handling).","Because network slices and network functions can be shared, malicious UE can create control plane storms.

AMF Message Flooding for a shared slice with shared NFs:
(1) An initial AMF validates if the user (UE) is allowed to access the subscribed S-NSSAI: AMF contacts the UDM to request the UE’s Slice Selection Subscription data.  The initial UDM may contact the UDR for the UE's Slice Selection Subscription data, then provides the data to the AMF.
(2) During the t0 to t-delta time interval that it takes to perform (1), the UE drops the initial AMF then re-attaches to the AMF, restarting the validation.
(3) The UE recursively performs (2), which recursively performs (1), creating a ""UE-AMF-UDM-UDR-AMF"" message storm sandwiched in between an ""Attach-Detach"" storm.
(4) Since this is a shared slice with shared NFs, the control plane storm (Attach-UE-AMF-UDM-UDR-AMF-Detach-Attach-recursively repeat) creates a DoS condition."
FGT5022,Alteration of subscriber  profile charging parameters,AMF/SMF can use Nudm_UECM_Update to modify UE context in the UDM.,"AMF or SMF can change some parameters in the UE context (which is like a subscriber profile, but valid only for a session; Section 5.2.3.2.5 of 23.502. The parameters are: PEI, analyticsID (for NWDAF), UE capabilities, Intersystem continuity context, SMF+PGW-C FQDN"
FGT5022,Alteration of subscriber  profile charging parameters,"Rogue AF/NEF via UDM can modify UE’s config for a given external service (e.g. pay for video for a game today). When the victim UE changes state from idle mode to connected mode, it will receive the modified services which may be inferior to the services originally provisioned.","NEF can use Nudm_ParameterProvision update service to update UE subscription data. Section 5.6.2.2 of TS29.503 & sections 4.15.6.2, 4.15.6.3, 4.15.6.3a of TS23.502."
FGT5022,Alteration of subscriber  profile charging parameters,Compromised OA&M can modify subscriber profile data in UDR,Compromised GUI or CLI based attack on subscriber database in UDR
FGT5028,Discover network slice identifier,"Assuming control of a network function, ask the NRF for a SD until a legitimate response is received (vs. an error).","Any “consumer NF” can ask the NRF for information with a guessed slice identifier, until a non-error response is returned. The NRF services that are candidates for this operation are (3GPP TS 29.510: discovery and Access token (Nnrf_NFDiscovery and Nnrf_AccessToken). For the Discovery service, in the GET NF instances, the parameters can be included “plmn-specific-snssai-list”, which contains the S-NSSAIs that are served by the NF supposedly being discovered. Then the 200OK result contains the IE NFProfile, which includes the S-NSSAIs."
FGT5012.002,Self Location Measurement,Self-location measurement,"Victim UE is using a system with null encryption oris bid down to a less secure protocol. UE geolocation or geolocation measurement data is passively observed or, if bid down, actively ordered through illegitimate signaling."
FGT5035.001,DOS a UE via fake cellular base station,Bidding Down induced DOS,"Victim UE is either actively or passive bid down to less secure protocol. Adversary acts as a man-in-the middle to deny service by (1) issuing registration reject messages or other orders to deny radio access, or (2) posing as a legitimate base station, but not relaying traffic to or from the intended recipient."
FGT5019.002,Intercept Bid-Down IMSI,Adversary with rogue base station bids-down UE and sends an Identity Request message to get back the IMSI,"When UE security profile allows bidding down, adversary denies service to 5G, bids down victim UE to less secure protocol, and then actively interrogates or passively intercepts unencrypted International Mobile Subscriber Identifier (IMSI)  for 2G/3G/4G or Media Access Control (MAC) for WiFi."
T1499.002,UDM DOS via SUCI replay,SUCI is replayed by rogue UE or gNB to the network,UDM needs to process repeated SUCI messages from the same UE which will eventually drain resources of UDM and cause DoS attack on legitimate UE. Sections 5.2.2.1.2 & 5.2.2.2.2 of [1]
T1046,Core-network scanning,"Tools exist for pen testing. Examples GTScan, SigPloit, SCTPScan and GTPScan.",
T1600.501,Radio interface,AMF exploit for weakening encryption of user traffic over the air interface,"Adversary takes over the AMF and enables NULL encryption for NAS and AS for all UEs; or, changes one Security Mode Command procedure for a given UE to enable NULL encryption or NULL integrity. This can be followed by another attack behavior whereby eavesdropping can be done over the air interface for data and signaling. Sections 5.3.2 & 5.5.1 of [2]"
T1600.501,Radio interface,SMF misconfiguration exploitation via adversary controlled gNB or via SMF control directly.,"Adversary makes the unauthorized change in the SMF CP & UP local policy to enable NULL encryption for CP & UP traffic. The SMF is not implemented to check (for every UE) that the local policy is the same as the UE policy stored in the UDM, and so the SMF lets the CP & UP traffic over the radio interface be protected via NULL encryption.
Alternatively, an attacker with control over a legitimate gNB, and who currently serves the UE, tells the SMF that the UE CP & UP policy is NULL encryption, and the (legit but not correctly implemented) SMF doesn’t check that against the local policy and lets the CP & UP data use NULL encryption.
These can be followed by another attack behavior whereby eavesdropping can be done over the air interface for data and signaling. Sections 5.3.2 & 5.5.1 of [2]"
T1600.501,Radio interface,Alteration of gNB configuration for AS encryption to enable NULL algorithms,Adversary intentionally configures NULL encryption and integrity protection algorithm to have highest priority in gNB. Sections 6.7.3 & D.1 of [2]
T1600.501,Radio interface,"Compromised source AMF sends incorrect UE context information to legitimate target AMF during
Initial registration & roaming or
Handover (N2 based)","Source AMF sends null encryption and integrity protection algorithm information as part of the “UEContextTransfer” (initial registration & roaming) or “CreateUEContext” (N2 handover) service request messages. All UE data will be sent in clear text after registration or handover is completed. Sections 4.2.2.2.2, 4.9.1.3.1 & 5.2.2.1 of [3] The element in the UE context is the ueSecurityCapability which the rogue AMF sets to NULL only."
T1600.501,Radio interface,Compromised source MME/AMF sends incorrect UE context information to legitimate target AMF during EPS to 5GS handover and roaming with and without N26 interface,"Source AMF sends NULL encryption and integrity protection algorithm information as part of the “UEContextTransfer” or 
“RelocateUEContext” service request messages. All UE data will be sent in clear text after roaming or handover is completed. Sections 4.11.1.2.2.2, 4.11.1.3.3, 4.11.2.3 & 5.2.2.1 of [3] The element in the UE context is the ueSecurityCapability which the rogue AMF sets to NULL only."
T1437,Control plane signaling disguise for C2,Third party app (AF)- NEF - UDM as a data exfiltration channel,"The signaling AF to NEF to UDM and back from UDM to NEF to AF is used in several procedures. Example: NIDD (non-IP data delivery) (see section 4.25 of 3GPP TS 23.502), or VN (Virtual Network) group management  (see section 4.15.6 of 3GPP TS 23.502)."
FGT5015,Device database manipulation,EIR database compromise,"Reference [1], DC-003, calls for the MNOs to employ an EIR. The rest of the attack is theoretical.
The AMF is the only function that checks the EIR based on permanent equipment id (PEI) using the API N5g-eir_EquipmentIdentityCheck_Get."
FGT5033,Retrieve UE subscription data,AMF can ask the UDM via the Nudm_sdm API to retrieve subscription data for a given SUPI.,"AMF can extract subscription data (including NSSAIs) for any given UE SUPI by asking the UDM (uses Nudm_SDM_Get service  (SDM=SubscriberDataManagement)). The UDM does not check that that AMF is the one serving the UE, i.e. the AMF does not need to register itself first as serving the UE, via the Nudm_UECM_Registration Request. Table 5.2.3.1-1 of [1]"
FGT5033,Retrieve UE subscription data,Rogue AMF in visited PLMN retrieves UE’s sensitive information using Nsmf_PDUSession_ContextRequest API during 5GS to EPC roaming.,"AMF in visited PLMN calls Nsmf_PDUSession_ContextRequest API to v/hSMF. SMF sends the UE SM context in response which can reveal the following UE information: SUPI, S-NSSAI, DNN, UE IP address etc. Section 4.11.1.2.1 & Table 5.2.8.2.10-1 of [1]"
FGT5033,Retrieve UE subscription data,SMF can ask the UDM via the Nudm-sdm API to retrieve some session management subscription info for a given SUPI.,"SMF can send to UDM a nudm-sdm message and retrieve “Session mgmt subscription data”, i.e. DNN configuration for all network slices."
FGT5033,Retrieve UE subscription data,UDM can look up any UE’s data or can see it in the UDR if a UDR is employed,UDM can legitimately get UE subscription data from UDR.
FGT5033,Retrieve UE subscription data,SMSF can get the UE subscription data for a given SUPI via the Nudm-sdm API.,SMSF can get the UE subscription data via Nudm_sdm.
FGT5033,Retrieve UE subscription data,NEF can get some of the UE subscription data for a given SUPI via Nudm-sdm API,Same as above.
FGT5026,SIM cloning,None,
T1499.502,Trigger Fraud Alert to Deny Service,"Capture a registration attempt for a given UE, then replay it right away to a gNB much further away","An adversary might deny RAN access to a UE by triggering a fraud alert through attempting simultaneous registrations at geographically impossible locations. When the UE security profile allows, the adversary can illegitimately use a known IMSI or, if a valid Subscriber Concealed Identity (SUCI) is known, use a legitimate SUCI for false registrations."
FGT5035,Fake cellular Base Station,Adversary uses the fake base station to broadcast spoofed configuration messages to UEs nearby,"Reference [2] (appendix B) contains a taxonomy of attacks against 5G UEs, passive and active. One concerns message attacks (fake MIB/SIB – Master Information Block/System Information Block)"
FGT5035,Fake cellular Base Station,Adversary installs an illegitimate complete gNB and configures the power so as to appear strongest to a given UE in a particular location,Reference [2]
FGT5024,SIM boxing,Adversary/fraudster/SIM boxers are effectively acting as an unlicensed and unregulated telecommunications carrier (pretends to be a legitimate telecom provider). Intercepts call & SMSs and re-routes,"Adversary intercepts call and routes it via the Internet as a VoIP call, to the SIMbox (instead of via a regulated MNO interconnect). See [3], [5]"
FGT5024,SIM boxing,"Adversary offers discounted call rates directly to end consumers, primarily through the sale of international calling cards. Intercepts call/SMS and reroutes.","Such cards have a number that the user must dial before she can dial the recipient’s number; this number will route to a number provided by a VoIP provider that points to the
SIMbox in the recipient’s country. See [3], [5]"
FGT5025,Falsify interconnect invoice,False charging,"In [1] section 5.3., Signaling Fraud: False charging over international signaling interconnection."
T1557.507,Non-SBI,Compromised or misconfigured switches or routers between RAN and core and between gNBs can disable integrity protection for CP & UP communication between RAN and core or between two gNBs,"Integrity protection can be disabled on N2 interface for CP, N3 interface for UP and Xn interface for CP & UP. Sections 9.2, 9.3 & 9.4 of [2]"
FGT5012.004,Core network function signaling,"Adversary uses SS7 interconnect (IWF) to a 5G network without protection (firewalls, etc). to obtain UE location information","From [3], there were recent successful attacks on SS7 whereby an attacker with access to the SS7 interconnection can find a user’s location, as well as billing data and Short Message Service (SMS) messages. In addition, the attacker can also eavesdrop on user data."
FGT5012.004,Core network function signaling,Adversary gains control of a core network function and obtain location info for a given UE,"Several NFs can be used, and each threat has different characteristics. They are:
* AMF case: get UE location legitimately from LMF (Nlmf-loc API). [Section 8.3 of TS 23.273]
* An adversary can modify AMF behavior so that it doesn't allocate a new 5G-GUTI to a given UE, so that that UE can be tracked via listening devices in the area.
* AF case: Incorrect implementation/configuration in NEF can allow a rogue application function (AF) to access UE location information using LMF services. [Section 6.1.2 of TS23.273]
* SMF case: SMF can obtain a UE's location whenever the AMF sends it a PDU update request:  Nsmf_PDUSession_UpdateSMContextRequest (which contains UE location info, which can be: E-UTRA or NR cell id, location timestamp, “geographicalInformation” in hex format as in TS 23.032, only ellipsoid point with uncertainty circle.) [section 5.2.8.2.6 of TS23.502]
* UDM case: UDM can legitimately ask the AMF for the location of a UE using Namf_Location service. [5.2.2.1 of TS23.502]
* UPF case: UPF has access to serving cell ID for UEs that are actively sending data (RRC connected).  
* NEF case: NEF can legitimately ask AMF Namf_EventExposure or ask GMLC directly - then GMLC gives the NEF a location report (Note: NEFs serve as location proxies to internal and external AFs in the same way GMLCs serve as proxies to external LCS clients). [5.2.2.1 of TS23.502]
* NWDAF case: NWDAF can get coarse UE location by subscribing to events from AMF. [5.2.2.1 of TS23.502]
* GMLC case: GMLC can legitimately ask the AMF for the location of a given UE using Namf_Location service. [5.2.2.1 of TS23.502]
* LMF case: can initiate location procedure with the UE. [6.11.1, 6.11.2, 6.11.3 of TS23.273]"
FGT5031,Call Detail Record (CDR) collection,"Malware “interacts with CDR databases” (possibly from the SMSC, which this malware infects).","Data miner loaded by installation script. The script CDR s for certain IMSIs, the info therein is call metadata, i.e. time, duration, phone numbers."
T1464,Jamming or Denial of Service,Numerous,Numerous
FGT5021,Tunnel ID uniqueness failure,"Rogue or wrong configuration/implementation in gNB or UPF can cause existing TEID to be assigned to a new N3 reference point or PDU session.

Duplicate TEID allocation can happen during EPS to 5GS handover or roaming.","Duplicate TEID can cause traffic disruption, charging issues and eavesdropping of legitimate subscriber data by adversary. Section 5.8.2.3 of [2], section 4.11.1.2.2 of [3]"
T1499.503,DOS a UE via gNB or NF signaling,gNB control (or fake UE),"Adversary with a fake UE can send a De-registration request to the victim UE's gNB with the victim 5G-GUTI. Or , adversary with a fake gNB can send  Deregistration request to the victim UE. Or, adversary with fake UE can try to register as the victim UE, and when the victim UE tries to RRC connect again, it will be rejected. See [2]"
T1499.503,DOS a UE via gNB or NF signaling,AMF control,"Adversary controlling AMF can cause authentication to fail or deny SMS service by deactivating SMS for a given SUPI [1]. Control of AMF can give an adversary the power to manipulate the AKA procedure between the AMF and any other UE, so that (at the simplest) the UE fails authentication and can't get services
Rogue or misconfigured NF modifies the registration accept message for legitimate subscribers to deny access to some or all services that are configured in their profile."
T1499.503,DOS a UE via gNB or NF signaling,SEAF control,Adversary controlling SEAF: change the parameters exchanged back to the home network
T1499.503,DOS a UE via gNB or NF signaling,SMF control,Adversary controlling SMF can release an existing PDU session or not create a new one; or send a  N4 Session Release request to UPF
T1499.503,DOS a UE via gNB or NF signaling,UPF control,"Adversary controlling UPF can send a report of PDU session inactivity, which results in de-activating the UE session. Or alter secondary authentication between DN AAA and SMF so it fails"
T1499.503,DOS a UE via gNB or NF signaling,AUSF control,Adversary controlling AUSF: produce incorrect AKA parameters or change data out of UDM
T1499.503,DOS a UE via gNB or NF signaling,UDM control,"Adversary controlling UDM: fail the SUPI de-concealing operation, UE key will be different and NAS SMC will fail (e.g., responding to SUCI deconcealment with an incorrect SUPI). See [3]."
T1499.503,DOS a UE via gNB or NF signaling,ARPF control,"Adversary controlling ARPF can
Alter the root key (K) or provide wrong root key for the UE
Generate wrong authentication vector (AV) during UE authentication procedure using EAP-AKA’ or 5G AKA.
Both will result in authentication failure for the UE.  [Section 6.1.3 of 33.501]"
T1499.503,DOS a UE via gNB or NF signaling,UDR control,"Adversary controlling UDR: give UDM incorrect security parameters, or remove UE authentication status."
T1499.503,DOS a UE via gNB or NF signaling,PCF control,Adversary controlling PCF: return a very restrictive policy for that UE.
T1499.503,DOS a UE via gNB or NF signaling,NSSF and NSSAAF control,Adversary controlling NSSF and NSSAAF: deny UE access to a slice by mishandling NSSAI (saying it's unavailable) or altering authentication params so that auth procedure fails.
T1499.503,DOS a UE via gNB or NF signaling,CHF control,Adversary controlling CHF: Send a message to SMF to start PDU session release.
T1499.503,DOS a UE via gNB or NF signaling,SMSF control,Adversary controlling SMSF: DOS only on SMS for a given UE.
T1499.503,DOS a UE via gNB or NF signaling,5G EIR control,Adversary controlling 5G EIR can mark UE as stolen.
T1499.503,DOS a UE via gNB or NF signaling,Home PLMN or visited PLMN SEPP,Adversary controlling home PLMN SEPP or visited PLMN SEPP can alter or discard registration request/response message and/or other signaling messages to deny access for a UE.
FGT5012.003,5G-GUTI reuse,Reportedly some operators do not allocate new 5G-GUTI every time the UE re-registers.,"Several operators do not re-allocate GUTI often enough or they use predictable patterns.  
Exact 5G-GUTI refresh mechanism is left to implementation. Mandatory refresh of 5G-GUTI is to be done by AMF for initial registration, mobility registration update and network-initiated service request message due to paging. [Section 6.12.3 of 33.501]"
FGT5018.001,Cabling and junction boxes,Disrupt service,[2] 11.2.3 advocates for cabling security
FGT5010,Fraudulent AMF registration for UE in UDM,Adversary registers an AMF it controls as the one serving a given UE that just de-registered,"Adversary controlling an AMF registers that AMF in UDM (via Nudm_UECM_Registration Request) as serving a given UE that de-registered. If the UDM implementation does not store the authentication status of UEs as de-registered, it will accept that AMF. Now that adversary controlled AMF can potentially mount other attacks 
Note that the UDM does not communicate with the AMF based on OAuth tokens. Since AMF to UDM signaling is part of the key UE control plane, it may be that they have a permanent TLS connection (TBC)"
FGT5016,Abuse of Inter-operator Interfaces,Manipulate data between two PLMNs,"In one approach, the adversary, in a position on an IPX, could modify the messages between the vPLMN (visited PLMN) and hPLMN (home PLMN) if PRINS is used, resulting in possible information modification and/or disclosure.  Modification of an Information element (IE) could enable possible denial of service and/or information disclosure and this is addressed in FGT5029."
FGT5016,Abuse of Inter-operator Interfaces,Compromise SEPP and modify signaling it sends,"If the adversary controls a vPLMN SEPP they may modify signaling on N32 and/or generate requests to hPLMN NFs. The adversary controlled vSEPP could terminate TLS connections to hPLMN NFs and proxy requests as an adversary-in-the-middle, see T1157.502. Legitimate looking requests that could result in information disclosure or fraud may involve Value Added Service (VAS), e.g. VAS providing SEPP to the VPLMN"
FGT5006.001,Layer 2 Proxy,,"Active attack. The aLTEr attack that exploits the fact that LTE user
data is encrypted in counter mode (AES-CTR) but not integrity
protected, which allows us to modify the message payload."
T1557.505,Service Based Interface,Triple Handshake,"(2014): if a TLS client connects to a malicious server and presents a client credential, the server can then impersonate the client at any other server that accepts the same credential. Concretely, the malicious server performs a man-in-the-middle attack on three successive handshakes between the honest client and server, and succeeds in impersonating the client on the third handshake. See e.g."
FGT5030,Network-side SMS collection,Malware loaded into a Linux running SMSC server,"Data miner loaded by installation script. The script targets and saves SMS messages (the contents, the IMSI and the source  and destination phone number). This is highly targeted to given IMSI numbers (e.g., proponents of movements against the Chinese gov’t). (note: CDR s were also targeted for certain IMSIs, the info therein is call metadata, i.e. time, duration, phone numbers). [1,2]"
FGT5008,Redirection of traffic via user plane network function,"Control UPF or able to send an N4 signaling to it, redirect UE traffic","An UPF can legitimately instruct the gNB to send traffic to a different UPF.
Adversary can send a Session Modification Request to the UPF (if they know its IP address and can spoof the source) redirect user traffic from the UPF to an attacker controlled server. To accomplish this, the attackers need to
change the IP address in the Outer Header Creation
Field. [4]"
FGT5008,Redirection of traffic via user plane network function,"Control SMF, redirect traffic","Adversary controlling the SMF can redirect existing uplink UE traffic by sending to UPF a N4 Session Modification Request (or: selecting another UPF- or, by sending to UPF another “Redirect server” [which the adversary controls] in the FAR in the N4 session (Cisco UPF-Config-Guide: “The UPF reports to the SMF whether it supports traffic redirection enforcement in the UPF through the UP-Function Features IE.”) Similarly, the SMF can send a session modification request to the UPF and redirect UE traffic (downlink) — See sections 4.4.1.2 & 4.4.1.3 of [5]."
FGT5008,Redirection of traffic via user plane network function,Rogue AF or rogue/misconfigured NEF can redirect traffic to undesired destinations.,"This service is designed for MEC applications for local processing of data traffic in order to reduce latency. However, this capability can be misused by rogue AF or rogue/misconfigured NEF. Section 5.6.7 Table 5.6.7-1 1st row 
“Traffic Description” of [6]."
FGT5012.001,Passive radio signals observation,Externals geolocation,"Adversary geolocates unknown UE using some combination of Direction of Arrival, Time-of-Arrival, and/or Frequency-of-Arrival of UE signal externals."
