T1464,UE or gNB Jamming,FGDS5001,Identify source and location of jammer.
T1600.502,Network interfaces,DS0029,Inspect network traffic and watch for unauthorized changes
T1600.502,Network interfaces,DS0015,Check configuration changes in gNB and all core NFs; Configuration audits by OSS/BSS.
T1599.502,Network Slice infrastructure  resource hijacking,DS0028,Audit Policy Violations - Automated user and resource policy compliance checks and instrumentation to alert on violation attempts
T1599.502,Network Slice infrastructure  resource hijacking,DS0015,"Audit logs - Auditing logs for security, authentication and authorization activity, host access, hosts, virtualization orchestrator and managers can reveal behavioral anomalies"
T1599.502,Network Slice infrastructure  resource hijacking,DS0013,Monitor systems performance
T1599.502,Network Slice infrastructure  resource hijacking,DS0029,Monitor network flows
FGT5005,Memory Scrapping,DS0015,Analyze logs to detect unauthorized activity
FGT5005,Memory Scrapping,DS0029,All inbound and outbound connections should be audited for unauthorized activity
T1562.501,Bid down UE,FGDS5013,"At the UE side, the UE can tell that there is a 5G cell site that it can hear, but if it eventually gets connected to a 4G cell site, then it may have suffered a bidding down attack"
T1498.503,_UE_DoS_to_AMF,DS0029,"Examine all header fields of control plane messages received in the uplink direction from UE to the core.
This can be done either by logging all messages received by the NF or by using a proxy or firewall at the core network entry point."
T1498.503,_UE_DoS_to_AMF,FGDS5015,Test all software patches for each core NF.
FGT5034,_Rogue_xApps_unauthorized_access,FGDS5021,Monitor all xApps onboarding processes. Use host scanning tools to detect malware insertions.
FGT5034,_Rogue_xApps_unauthorized_access,DS0025,"Monitor logs for authentication/authorization of xApps to near-RT RIC and E2 nodes, logs for each transaction done by xApps to E2 nodes. Audit logs and telemetry data for unauthorized activities."
FGT5034,_Rogue_xApps_unauthorized_access,DS0010,"Perform real-time audits and post-processing of logs.
Detect which parts of the RAN is accessed by each xApp e.g. O-DU, O-CU-CP, O-CU-UP, O-RU etc."
FGT5034,_Rogue_xApps_unauthorized_access,DS0006,Monitor access token usage by xApps.
FGT5034,_Rogue_xApps_unauthorized_access,DS0037,Verify and refresh frequently digital signatures used for authenticating xApps by near-RT RIC and E2 nodes.
FGT5034,_Rogue_xApps_unauthorized_access,FGDS5015,Verify xApp image hash
FGT5012.008,_Diameter_signaling,DS0029,Monitor all communications over Diameter and SS7/MAP based interfaces to/from core network.
T1572.501,UE Access via GTP-U,FGDS5016,Examine all IP packets received from the internet at UPF/PGW with encapsulated GTP-U payload.
T1572.501,UE Access via GTP-U,DS0029,Monitor incoming packets on N6 interface for any unauthorized data sessions.
FGT5002,Bypass home routing,DS0015,"Logs of externally received messages requesting location of user or, logs of outgoing responses to such messages can detect anomalies. Logs are on the NF or functions which interface SMS home router such as MAP IWF or SMSC. See Figure 27 of [3]."
T1557.501,Radio Interface,FGDS5002,"UE measurements of received power levels from all base stations nearby, and their identifiers Reference clause 6.24 of [3]"
T1592.501,Internal resource search,FGDS5009,Access to IR.21 file should be logged.
T1592.501,Internal resource search,FGDS5008,Leaking this information on the Internet is obvious
FGT5012.002,Self Location Measurement,FGDS5010,Subscriber transitions to less secure service.
T1078.004,Container Management- Unauthorized access,DS0028,Monitor for suspicious account behavior across cloud services that share account.  Logon session logs and meta data helps determine if the session was an authorized activity.
T1078.004,Container Management- Unauthorized access,DS0002,"Monitor user account authentication activity.  Monitor the activity of cloud accounts to detect abnormal or malicious behavior, such as accessing information outside of the normal function of the account or account usage at atypical hours.  Repeated attempts may be indictive of password guessing or brute force password cracking.  Password policies supporting lockout requiring administrative reset may help."
FGT5028,Discover network slice identifier,DS0015,"Logs at the NRF of failed NSSAI lookups. If a NF asks for NSSAIs that do not exist, then flag that or take action.

AMF can ask the UDM about NSSAIs legitimately. Keep AMF and UDM logs of transactions involving asks about NSSAIs."
T1040.502,_Fronthaul_User_Plane_Data,FGDS5022,Monitor if security configurations in O-RU and O-DU are downgraded to weak or no security levels.
FGT5023,Charging fraud via NF control,FGDS5003,Management system (OSS/BSS) checks uniqueness of charging ID for all new PDU sessions in non-roaming scenario and existing PDU sessions in handover and roaming scenario
FGT5027,Spoof network slice identifier,DS0015,"Check logs of requests/responses at the shared NF. E.g., each entry should contain UE ID (SUPI), NF consumer that requested it, slice Ids of both."
