TempID,Domain,Platform/Architecture,Tactics,New FGTID,Technique Name,BLUF
792,5G Implementation,"Arch-Control plane, Arch-Roaming",exfiltration,ADDENDUM TO T1048.003,DNS Queries,Adversaries may steal data by exfiltrating from a MNO by sending it over allowed DNS queries to DNS servers outside the MNO.
795,5G Implementation,"Arch-Control plane, Arch-Roaming",exfiltration,ADDENDUM TO T1048,Control plane signaling exfiltration,An adversary may use Control Plane signaling between operator-internal Network Functions and externally-facing NFs or proxies to exfiltrate data to external endpoints.
796,5G Implementation,"Impl-OA&M,  Arch-MEC",Resource-development,ADDENDUM TO T1583,Access to cloud infra or MEC,An adversary may purchase access to cloud infrastructure or Multi-access Edge Computing (MEC) resources that will also be hosting the operator’s infrastructure
800,5G Implementation," Arch-User plane, Arch-Control plane, Arch-Roaming",defense-evasion,FGT5009.002,Network Interfaces,"An adversary may change the configuration of network nodes so as to disable or weaken integrity protection on the network interfaces Non-SBI, SBI and Roaming, thus allowing for transmitted data manipulation."
801,5G Implementation,"Arch-Control plane, Arch-User plane",defense-evasion,T1600.502,Network Interfaces,"An adversary may alter network signaling so as to use weakened or no encryption algorithm on the Non-SBI (Service Based Interface), SBI and Roaming interfaces, thus allowing for eavesdropping of user data or signaling."
804,5G Implementation,"Arch-MEC, Impl-OA&M",initial-access,T1195.502,Compromise Service Supply Chain,Adversaries may manipulate service or service delivery mechanisms prior to or while used by a mobile network operator (MNO) for the purpose of data or system compromise.
807,5G Implementation,Arch-RAN,discovery,FGT5019.004,Intercept unencrypted SUPI,An adversary may intercept unencrypted radio transmissions of a UE’s SUCI to identify the IMSI/SUPI of the UE.
NEW,5G Implementation,Arch-Roaming,"initial-access, Collection",FGT5029,Exploit Semi-public Facing Application,"Adversary send specifically crafted messages from an interconnect/interworking partner against roaming interface to gain access to the service function, e.g. SEPP, or cause a denial of service (DoS)."
