FGMID,Mitigation Name,Mitigation Description,where is it found?
FGM1499,Secure file transfer,Securely transfer sensitive files between two end points,
FGM1502,Increase RACH (Random Access CHannel resources),"Increase RACH resources on the gNB (bandwith, time slots)",
FGM1505,Proxy home network,"When the subscriber affiliation is reflected in the home network identifier (part of subscriber identifier), and would benefit from not being sent in the clear, the subscriber's provider (home network) should be a proxy mobile network operator - whose identifier does not reveal the true affiliation of the subscriber.",
FGM1506,Periodic authentication and authorization of NFs,Perform periodic authentication and authorization of consumer NFs by NRF,
FGM1557,Integrity protection of data communication,Use strong data integrity protection algorithms.,
FGM5001,Disable malicious transmitter,Disable or remove an RF transmitter,
FGM5002,Discard RAN signaling received without integrity protection,"User Equipment (UE) can reject e.g. RRC signaling such as RRC Release with Redirect info, if not integrity protected.",
FGM5003,Cross check between application layer and transport layer,NFs such as NRF should cross check with TLS layer before issuing token to an NF,
FGM5004,Correctly configure SS7 firewall,"Employ a SMS Router that intercepts incoming location queries (from other operators), configured so that it can't be subverted.",
FGM5005,Physical and environmental protection,"Physical protection of: communications centers, Telecommunications equipment room, Physically isolated operation areas, Equipment sited in other carrier's or partner's premises, cable/fibers, junction boxes, ",
FGM5006,Restrictive user profile,This profile does not allow bidding down to 4G,
FGM5007,Unlimited data plan,Subscription that includes unlimited data can prevent DoS due to exhausion of data plan limits,
FGM5008,Monitor installed applications for data usage,"On the UE, monitor installed applications for data usage and perform throttling if necessary",
FGM5009,Non-Persistent Information,Information is refreshed to a known trusted state and deleted when no longer needed.,
FGM5010,Non-Persistent Services,Services are refreshed periodically and/or terminated after completion of a request.,
FGM5011,Non-Persistent Connectivity,Connections are terminated after completion of a request or after a period of non-use.,
FGM5012,Slice ID check,Check if IMSI is served by the slice ID (NSSAI),
FGM5013,Timely updates to UE status,UDM/UDR should correctly implement UE authentication/registration status updates.,
FGM5014,UE location plausibility,UDM can check whether a requesting AMF is likely to be the one serving that UE.,
FGM5019,Authorize external API calls,NEF should authorize API calls especially from external AFs for service accesses,
FGM5020,Secure subscriber repositories,Including EIR Equipment Identity Register,
FGM5033,Zero Trust,Use zero trust principles for application/NF protection,
FGM5088,Separate repositories for development and production,Separate repositositories must be maintained for development and production software to avoid access and image slipovers,
FGM5089,Verify image in deployment,Use image name and hash to verify image during deployment,
FGM5090,Log correlation,Correlate logs between SDN controllers and network elements,
FGM5091,Mutual authentication,"Enforce mutual authentication between SDN controller, network elements, SDN controller and SDN application",
FGM5092,Warn user,UE warn user of lower security network. ,
FGM5093,SUCI freshness parameter,UDM/SIDF checks if SUCI freshness parameter from the same UE (with same SUPI) is identical during SUCI deconcealment within a short period of time,
FGM5094,Allocate new 5G identifiers judiciously,Network (AMF) should allocate new 5G-GUTI whenever possible; UPF/and gBN should allocate unique Tunnel IDs.SMF should check newly allocated charging IDs.,
FGM5095,TLS certificate check,Verify if the TLS certificate is valid for the endpoint,
FGM5096,Disable UE location use,Disable usage of location on UE device,
FGM5097,Disable acceptance of a less secure system,Restrict UE to bid down (from 5G) or use of less secure system,
FGM5098,Reduce UE usage,Use UE only when needed. Turn power off when not in use.,
FGM5099,Move UE close to gNB,Move UE close to gNB or indoors to make geo-location harder,
FGM5100,Raise height of UE,"Raising the height of the UE may move it outside another RF source, e.g. jammer",
FGM5101,Isolate CDR database,Isolate CDR databases from the rest of the IT systems/NOC resources,
FGM5498,Limit incoming signaling traffic,Use a firewall or other rate limiter for signaling traffic coming into 5G network,
FGM5499,Rate limiting by producer NF,Producer NF e.g. AUSF can rate limit authentication requests from the same SUCI/SUPI too many times in a short period. Or NRF not respond to requests after a given number of failed NSSAI lookups,
FGM5500,Restrict access to operator OA&M resources,E.g. restrict access to IR.21 database,
FGM5501,TLS proxy/firewalls with DPI on the SBA,Operator should deploy TLS proxies or firewalls on the SBA that can inspect packets to detect anomalies,
FGM5503,Increase control of home network for user plane,Examples: employ home routing vs. local bypass.,
FGM5504,Resource Isolation in virtualization environment,"Cloud compute, cloud storage and any serverless activity should be isolated from other tenants  ",
FGM5505,Hardware mediated  execution environment,Hardware mediated  execution environment,
FGM5506,Network slice templates,"Use of Network Slice Templates -Use of templates for network slicing can enforce baseline security and isolation requirements.  These templates can be created for networks, compute and 5G slice functions deployments.",
FGM5540,Power supplies,Continuity of power supplies to equipment deployed in the field.,
M1013,Application Developer Guidance,This mitigation describes any guidance or training given to developers of applications to avoid introducing security weaknesses that an adversary may be able to take advantage of.,
M1015,Active Directory Configuration,"Configure Active Directory to prevent use of certain techniques; use SID Filtering, etc.",
M1016,Vulnerability Scanning,Vulnerability scanning is used to find potentially exploitable software vulnerabilities to remediate them.,
M1017,User Training,"Train users to be aware of access or manipulation attempts by an adversary to reduce the risk of successful spearphishing, social engineering, and other techniques that involve user interaction.",
M1018,User Account Management,"Manage the creation, modification, use, and permissions associated to user accounts.",
M1019,Threat Intelligence Program,A threat intelligence program helps an organization generate their own threat intelligence information and track trends to inform defensive priorities to mitigate risk.,
M1020,SSL/TLS Inspection,Break and inspect SSL/TLS sessions to look at encrypted web traffic for adversary activity.,
M1021,Restrict Web-Based Content,"Restrict use of certain websites, block downloads/attachments, block Javascript, restrict browser extensions, etc.",
M1022,Restrict File and Directory Permissions,Restrict access by setting directory and file permissions that are not specific to users or privileged accounts.,
M1024,Restrict Registry Permissions,Restrict the ability to modify certain hives or keys in the Windows Registry.,
M1025,Privileged Process Integrity,"Protect processes with high privileges that can be used to interact with critical system components through use of protected process light, anti-process injection defenses, or other process integrity enforcement measures.",
M1026,Privileged Account Management,"Manage the creation, modification, use, and permissions associated to privileged accounts, including SYSTEM and root.",
M1027,Password Policies,Set and enforce secure password policies for accounts.,
M1028,Operating System Configuration,Make configuration changes related to the operating system or a common feature of the operating system that result in system hardening against techniques.,
M1029,Remote Data Storage,Use remote security log and sensitive file storage where access can be controlled better to prevent exposure of intrusion detection log data or sensitive information.,
M1030,Network Segmentation,"Architect sections of the network to isolate critical systems, functions, or resources. Use physical and logical segmentation to prevent access to potentially sensitive systems and information. Use a DMZ to contain any internet-facing services that should not be exposed from the internal network. Configure separate virtual private cloud (VPC) instances to isolate critical cloud systems.",
M1031,Network Intrusion Prevention,Use intrusion detection signatures to block traffic at network boundaries.,
M1032,Multi-factor Authentication,Use two or more pieces of evidence to authenticate to a system; such as username and password in addition to a token from a physical smart card or token generator.,
M1033,Limit Software Installation,Block users or groups from installing unapproved software.,
M1034,Limit Hardware Installation,"Block users or groups from installing or using unapproved hardware on systems, including USB devices.",
M1035,Limit Access to Resource Over Network,"Prevent access to file shares, remote access to systems, unnecessary services. Mechanisms to limit access may include use of network concentrators, RDP gateways, etc.",
M1036,Account Use Policies,"Configure features related to account use like login attempt lockouts, specific login times, etc.",
M1037,Filter Network Traffic,Use network appliances to filter ingress or egress traffic and perform protocol-based filtering. Configure software on endpoints to filter network traffic.,
M1038,Execution Prevention,"Block execution of code on a system through application control, and/or script blocking.",
M1039,Environment Variable Permissions,Prevent modification of environment variables by unauthorized users and groups.,
M1040,Behavior Prevention on Endpoint,"Use capabilities to prevent suspicious behavior patterns from occurring on endpoint systems. This could include suspicious process, file, API call, etc. behavior.",
M1041,Encrypt Sensitive Information,Protect sensitive information with strong encryption.,
M1042,Disable or Remove Feature or Program,Remove or deny access to unnecessary and potentially vulnerable software to prevent abuse by adversaries.,
M1043,Credential Access Protection,Use capabilities to prevent successful credential access by adversaries; including blocking forms of credential dumping.,
M1044,Restrict Library Loading,Prevent abuse of library loading mechanisms in the operating system and software to load untrusted code by configuring appropriate library loading mechanisms and investigating potential vulnerable software.,
M1045,Code Signing,Enforce binary and application integrity with digital signature verification to prevent untrusted code from executing.,
M1046,Boot Integrity,Use secure methods to boot a system and verify the integrity of the operating system and loading mechanisms.,
M1047,Audit,"Perform audits or scans of systems, permissions, insecure software, insecure configurations, etc. to identify potential weaknesses.",
M1048,Application Isolation and Sandboxing,Restrict execution of code to a virtual environment on or in transit to an endpoint system.,
M1049,Antivirus/Antimalware,Use signatures or heuristics to detect malicious software.,
M1050,Exploit Protection,Use capabilities to detect and block conditions that may lead to or be indicative of a software exploit occurring.,
M1051,Update Software,Perform regular software updates to mitigate exploitation risk.,
M1052,User Account Control,Configure Windows User Account Control to mitigate risk of adversaries obtaining elevated process access.,
M1053,Data Backup,Take and store data backups from end user systems and critical servers. Ensure backup and storage systems are hardened and kept separate from the corporate network to prevent compromise.,
M1054,Software Configuration,Implement configuration changes to software (other than the operating system) to mitigate security risks associated to how the software operates.,
M1055,Do Not Mitigate,This category is to associate techniques that mitigation might increase risk of compromise and therefore mitigation is not recommended.,
M1056,Pre-compromise,"This category is used for any applicable mitigation activities that apply to techniques occurring before an adversary gains Initial Access, such as Reconnaissance and Resource Development techniques.",
M1057,Data Loss Prevention,"Use a data loss prevention (DLP) strategy to categorize sensitive data, identify data formats indicative of personal identifiable information (PII), and restrict exfiltration of sensitive data.",
VOID,Verify legitimate use of access token,Chcek if the slice using access token is authorized to use the token,
